{
  "$schema": "https://json-schema.org/draft/2020-12/schema",
  "$id": "https://smart-health-checkin.org/connectathon/participants/schema.json",
  "title": "Connectathon participant",
  "description": "One file per organization, named participants/<organization-id>.json. Everything in it is public.",
  "type": "object",
  "additionalProperties": false,
  "required": [
    "organization",
    "contacts",
    "components"
  ],
  "properties": {
    "organization": {
      "type": "string",
      "minLength": 1,
      "description": "Organization name as it should appear in the directory."
    },
    "homepage": {
      "type": "string",
      "format": "uri"
    },
    "contacts": {
      "type": "array",
      "minItems": 1,
      "description": "Who to reach during testing. Everything here is public. Pull requests by a contact with a GitHub username merge automatically; only these contacts can change the file.",
      "items": {
        "type": "object",
        "additionalProperties": false,
        "required": [
          "name"
        ],
        "anyOf": [
          { "required": ["github"] },
          { "required": ["slack"] },
          { "required": ["email"] }
        ],
        "properties": {
          "name": {
            "type": "string",
            "minLength": 1
          },
          "github": {
            "type": "string",
            "pattern": "^[A-Za-z0-9][A-Za-z0-9-]*$",
            "description": "GitHub username, without @"
          },
          "slack": {
            "type": "string",
            "minLength": 1,
            "description": "Display name in the CMS Health Tech Ecosystem Slack"
          },
          "email": {
            "type": "string",
            "format": "email"
          }
        }
      }
    },
    "components": {
      "type": "array",
      "minItems": 1,
      "items": {
        "type": "object",
        "additionalProperties": false,
        "required": [
          "id",
          "role",
          "name",
          "status"
        ],
        "properties": {
          "id": {
            "type": "string",
            "pattern": "^[a-z0-9][a-z0-9-]*$",
            "description": "Unique across all participants. Used in result reports, and for a web wallet it is also its registry id."
          },
          "role": {
            "enum": [
              "verifier",
              "web-wallet",
              "native-wallet"
            ],
            "description": "verifier: the side that asks for data. EHR check-in pages, patient portals, kiosks, and clinic apps register as Verifiers. web-wallet: a wallet that runs as a website, listed in wallets.json. native-wallet: a phone app reached through the phone's wallet chooser; not in wallets.json."
          },
          "name": {
            "type": "string",
            "minLength": 1
          },
          "description": {
            "type": "string",
            "description": "One or two sentences for the directory, and for wallet menus when this is a web wallet."
          },
          "status": {
            "enum": [
              "up",
              "not-yet",
              "broken"
            ],
            "description": "up: ready to test now. For a web page or web wallet, anyone can open it without you. For a phone app, it works and testers can get it the way access says. not-yet: not ready. broken: was up, isn't now. Only web wallets that are up go into wallets.json."
          },
          "url": {
            "type": "string",
            "format": "uri",
            "description": "Verifier that runs as a web page: the public page that starts a check-in."
          },
          "walletUrl": {
            "type": "string",
            "format": "uri",
            "description": "Web wallet: the page a Verifier opens. Goes into wallets.json."
          },
          "iconUrl": {
            "type": "string",
            "format": "uri",
            "description": "Web wallet: icon shown in wallet menus."
          },
          "homepage": {
            "type": "string",
            "format": "uri",
            "description": "Web wallet: the product's home page, shown in wallet menus. Defaults to the organization's homepage."
          },
          "target": {
            "enum": [
              "tab",
              "popup"
            ],
            "description": "Web wallet: how the Verifier opens it. Default tab."
          },
          "platforms": {
            "type": "array",
            "minItems": 1,
            "uniqueItems": true,
            "items": {
              "enum": [
                "android",
                "ios"
              ]
            },
            "description": "Phone app (a native wallet, or a Verifier that is an app): which phones it runs on."
          },
          "access": {
            "enum": [
              "install",
              "invite",
              "team-device"
            ],
            "description": "Phone app: how testers get it. install: anyone can install it from installUrl (the default when access is left out). invite: testers ask a contact for an invite or a build. team-device: there's no build to share; testers try it with the team, on the team's phone."
          },
          "installUrl": {
            "type": "string",
            "format": "uri",
            "description": "Phone app: where to install it (an APK, a public TestFlight link, or a store page). Required unless access is invite or team-device."
          },
          "requirements": {
            "type": "string",
            "description": "Phone app: what a tester's phone needs, such as the OS and browser versions."
          },
          "testPatient": {
            "type": "string",
            "description": "Wallets: the synthetic patient it holds, so Verifier testers know what to expect."
          },
          "notes": {
            "type": "string",
            "description": "Anything else a tester needs to know, such as a sign-in step or how to ask for an invite."
          }
        },
        "allOf": [
          {
            "if": {
              "properties": { "role": { "const": "verifier" } }
            },
            "then": {
              "anyOf": [
                { "required": ["url"] },
                { "required": ["platforms"] }
              ]
            }
          },
          {
            "if": {
              "properties": { "role": { "const": "web-wallet" } }
            },
            "then": {
              "required": ["walletUrl"]
            }
          },
          {
            "if": {
              "properties": { "role": { "const": "native-wallet" } }
            },
            "then": {
              "required": ["platforms"]
            }
          },
          {
            "if": {
              "required": ["platforms"],
              "not": {
                "required": ["access"],
                "properties": { "access": { "enum": ["invite", "team-device"] } }
              }
            },
            "then": {
              "required": ["installUrl"]
            }
          }
        ]
      }
    }
  }
}
