{"organization":"UnitedHealth Group","homepage":"https://www.unitedhealthgroup.com/","contacts":[{"name":"Nick Fontana","github":"nickf17","email":"nick_fontana@optum.com"},{"name":"Ian Knuth","email":"ian.knuth@optum.com"},{"name":"Chethan Reddy","email":"chethan_r_reddy@optum.com"},{"name":"Bushra Syeda","email":"syeda_bushra@optum.com"},{"name":"Zach Scott","email":"zachary.j.scott@optum.com"}],"components":[{"id":"uhc-smart-wallet","role":"web-wallet","name":"UHC Smart Wallet","status":"up","target":"tab","description":"US Core records, a digital insurance card, and check-in forms, shared item by item and record by record. Renders questionnaires and SMART Health Cards. Test patients, all synthetic and switchable on the consent screen: Avery Stone, born 1984, with problems, allergies, medications, immunizations, labs, vitals and a CARIN insurance card; Jordan Reed, born 1997, demographics only, so every other item comes back unavailable; and Rowan Vale, born 1958, with a large record. From UnitedHealth Group.","walletUrl":"https://healthsafe-connectathon.uhg.com/","iconUrl":"https://healthsafe-connectathon.uhg.com/icon.webp"}]}
