{
  "organization": "SMART Health IT",
  "homepage": "https://smarthealthit.org",
  "contacts": [
    {
      "name": "Josh Mandel",
      "github": "jmandel"
    }
  ],
  "components": [
    {
      "id": "smart-reference-ehr",
      "role": "verifier",
      "name": "Reference clinic check-in page",
      "description": "The client library's clinic demo. Pick a request, pick a wallet, and see the decrypted, checked response.",
      "status": "up",
      "url": "https://smart-health-checkin.org/client/demo/"
    },
    {
      "id": "smart-testing-ehr",
      "role": "verifier",
      "name": "Testing EHR",
      "description": "Sends any connectathon request to any registered wallet and checks the response against the spec.",
      "status": "up",
      "url": "https://smart-health-checkin.org/connectathon/testing-ehr/"
    },
    {
      "id": "smart-verifier-app",
      "role": "verifier",
      "name": "Example native Verifier app",
      "description": "An Android app that asks for a check-in. It calls Credential Manager directly to reach the phone's wallets, and can reach web wallets too through the bridge page in a Custom Tab.",
      "status": "up",
      "platforms": [
        "android"
      ],
      "access": "install",
      "installUrl": "https://github.com/smart-health-checkin/android-wallet/releases/latest/download/smart-health-checkin-verifier.apk",
      "requirements": "Android 8 or later with a Chrome version that has the Digital Credentials API",
      "notes": "Two buttons: \"Check in with a wallet on this phone\" calls Credential Manager directly (install a native wallet, such as the reference Android wallet, first); \"Check in through the browser\" opens the bridge page, which lists the connectathon's web wallets and the phone's wallets. The developer guide is https://smart-health-checkin.org/client/docs/native-apps.html."
    },
    {
      "id": "smart-testing-wallet",
      "role": "web-wallet",
      "name": "SMART Testing Wallet",
      "description": "Answers every connectathon request with realistic data, renders questionnaires, and can send deliberately broken responses.",
      "status": "up",
      "walletUrl": "https://smart-health-checkin.org/connectathon/testing-wallet/",
      "target": "tab",
      "testPatient": "Aria Test, born 1981, with problems, allergies, medications, immunizations, and CARIN and US Core insurance; a second patient with a large record, for the larger-data scenarios",
      "iconUrl": "https://smart-health-checkin.org/connectathon/icons/smart-starburst.svg"
    },
    {
      "id": "smart-android-wallet",
      "role": "native-wallet",
      "name": "SMART reference Android wallet",
      "description": "Native wallet answering through Credential Manager. Renders questionnaires.",
      "status": "up",
      "platforms": [
        "android"
      ],
      "access": "install",
      "installUrl": "https://github.com/smart-health-checkin/android-wallet/releases/latest/download/smart-health-checkin-wallet.apk",
      "requirements": "Android 8 or later, with a Chrome version that has the Digital Credentials API",
      "testPatient": "Aria Test, or the large record, chosen on the app's home screen",
      "notes": "Open the app once after installing so it registers with the phone's Credential Manager. Installing over a build older than 0.3.6 needs an uninstall first."
    }
  ]
}
